word,definition,synonyms,example
analyze,examine something carefully,examine; study,Students analyze the passage before answering the questions.
retain,keep or remember information,keep; preserve,Review sheets help students retain new vocabulary.
infer,understand something from evidence,deduce; conclude,Students infer the meaning from context clues.
precise,exact and accurate,accurate; exact,Use precise definitions in vocabulary tests.
consistent,staying the same over time,steady; regular,Consistent review improves long-term memory.
